Product_Name,Product_Price,Off,Product_Rating,Solds,Local,Original_Price
Mini Projetor Portátil Curta Distancia Led 1080p 600 Lúmens Hdmi YG300 Envio Imediato,"117,50",-51%,4.5,"17,4mil vendidos",São Paulo,239.795918367347
Máquina De Algodão Doce Elétrica Portatil Mini 110v,"118,80",-6%,4.8,12 vendidos,São Paulo,126.3829787234043
Sanduicheira Grill Elétrica Lenoxx Easy PSD119 Vermelha,"79,99",-23%,4.8,947 vendidos,Rio de Janeiro,103.8831168831169
Ventilador de Mesa Mondial 6 Pás Super Power Preto VSP-30-B - 30cm 127V,"119,90",-14%,4.9,818 vendidos,Bahia,139.4186046511628
Aspirador de Pó Vertical 2 em 1 Philco Ph1100AZ Rapid Turbo 1250W,"239,90", ,4.9,"1,5mil vendidos",Espírito Santo,239.9
Aparelho de Passar Roupa a Vapor Cadence Lisser VAP901 Branco 127V,"97,99",-48%,4.8,36 vendidos,Rio de Janeiro,188.4423076923077
Cooktop de Indução 4 Bocas Preto com Trava de Segurança Dako Supreme 220V,"1.719,00", , ,1 vendidos,Paraná,1719.0
Aspirador de Pó Robô Automático 3 em 1 Varre Aspira e Passa Pano MOP WAP ROBOT W90 PÉROLA - Bivolt,"459,90", ,4.9,100 vendidos,Espírito Santo,459.9
"Filtro de linha Ts shara + Protetor 6 Tomadas 1,5M","43,90", ,4.7,4 vendidos,Espírito Santo,43.9
Máquina de Macarrão Portátil Sem Fio Amarela Tomate,"174,53",-65%,5.0,2 vendidos,São Paulo,498.6571428571429
"Filtro de linha Ts shara + Protetor 8 Tomadas 1,5M","49,90", , , ,Espírito Santo,49.9
Papa Bolinhas Eletrico Recarregável X-7001 Bivolt,"49,53",-45%, ,1 vendidos,São Paulo,90.05454545454545
Controle Remoto para Fita LED RGB com Controlador Eletrorastro,"6,80", ,4.9,141 vendidos,Ceará,6.8
Projetor Hy300 Hd 200 Ansi Smart Cinema Bluetooth 5.0 Bivolt Android 11 5G Wifi 6 Envio Imediato,"317,50",-57%,4.9,258 vendidos,São Paulo,738.3720930232557
Aspirador de Pó Vertical 2 em 1 Kärcher VCL 2 com Filtro Hepa 1000W,"259,00",-35%,4.9,"1,3mil vendidos",São Paulo,398.4615384615385
Filtro De Agua Natural Preto Purificador De Agua,"129,35",-35%,4.9,"4,3mil vendidos",São Paulo,199.0
Fogão 4 bocas Atlas Mônaco Plus Preto com Acendimento Automático e Mesa Inox,"849,00", ,4.8,117 vendidos,Paraná,849.0
Fogão 5 Bocas Preto com Mesa Inox Atlas Agile Up Bivolt,"1.439,00", ,5.0,20 vendidos,Paraná,1439.0
Panela Elétrica de Arroz 10 xícaras 1.8L - Inox – Com legumeira - Multifuncional - In Brasil,"168,70",-30%,4.8,487 vendidos,Espírito Santo,241.0
SMATRUL Controle Remoto Inteligente IR WiFi Blaster Controlador Repetidor Universal Hub Trabalho Com Alexa Tuya APP Smart Household,"24,07",-51%,4.5,1mil vendidos,Internacional,49.12244897959184
Fritadeira Air fryer 4 Litros GourmetFry Modelo Dual Cyclone 1500W 127V,"299,90",-50%, , ,Minas Gerais,599.8
Cooktop 5 Bocas Preto com Mesa de Vidro Atlas Agile Up Bivolt,"589,00", ,5.0,197 vendidos,Paraná,589.0
Fogão cooktop a gás 5 bocas inox,"529,00",-5%,4.8,176 vendidos,Santa Catarina,556.8421052631579
Fogão Atlas 4 bocas branco com forno Limpa Fácil Coliseum Plus - Forno 50L,"739,00", ,4.9,171 vendidos,Paraná,739.0
Fogão 5 Bocas Preto com Mesa de Inox Dako Magister Bivolt,"2.089,00", ,5.0,24 vendidos,Paraná,2089.0
Mini Panela Elétrica Portátil De Arroz Pequena De Cozimento Multifuncional De Macarrão Instantâneo,"54,99",-37%,4.8,"1,6mil vendidos",Internacional,87.28571428571429
Fogão 4 Bocas Preto com Mesa de Vidro Atlas Agile Up Bivolt,"1.299,00", ,4.9,16 vendidos,Paraná,1299.0
Fogão Atlas 4 Bocas preto Mônaco Top Glass com Acendimento automático - Bivolt,"1.179,00", ,4.8,17 vendidos,Paraná,1179.0
Ventilador de Parede Oscilante Vop Good 50cm Preto Ponente coisas diferentes para casa,"158,70",-14%,4.7,465 vendidos,São Paulo,184.5348837209302
Aspirador de pó sem fio portátil para limpeza manual do carro USB doméstico conveniente e multifuncional,"87,99",-56%,4.7,"1,3mil vendidos",São Paulo,199.9772727272727
Aspirador De Pó E Liquido Automotivo Portátil Turbo Tech One 90w 12v,"119,90",-25%,4.5,"1,2mil vendidos",Rio de Janeiro,159.8666666666667
Fogão 4 Bocas Preto com Mesa Inox Atlas Atenas Bivolt,"929,00", ,4.9,40 vendidos,Paraná,929.0
Campainha com Câmera Inteligente Recarregável Interfone,"116,06",-5%, , ,São Paulo,122.1684210526316
Forno de bancada elétrico Dako Supreme Preto 44 litros com grill dourador - 220v,"749,00", ,4.6,22 vendidos,Paraná,749.0
Fogão 4 Bocas Preto com Mesa Inox Atlas Agile Up Bivolt,"1.019,00", ,4.7,14 vendidos,Paraná,1019.0
Fogão Atlas 4 Bocas branco Mônaco Top Glass com Acendimento automático - Bivolt,"1.159,00", ,4.6,9 vendidos,Paraná,1159.0
"Campainha De Vídeo Sem Fio WiFi , Segurança Recarregável , Visão Noturna HD Apenas Suporta 2.4G 2.4G Não 5G Com 1 Ding Dong","61,40",-38%,4.8,218 vendidos,Internacional,99.03225806451611
Mini Ventilador Portátil Climatizador Umidificador com Luz Led Usb,"100,00",-28%, , ,São Paulo,138.8888888888889
Cafeteira Black+decker 18 Cafés Inox Cm15-br 127v Cor Preto,"156,99",-13%,4.9,1mil vendidos,Espírito Santo,180.448275862069
Fogão de Embutir 5 Bocas Preto com Mesa de Vidro Dako Diplomata Bivolt,"2.799,00", , ,1 vendidos,Paraná,2799.0
5em1 Novo Estilo de Aspirador de Vácuo para Carros Atacado Mini Sopro de Sucção Doméstico Integrado Sem Fio Portátil para Carros Portáteis C,"43,33",-36%,4.4,662 vendidos,Internacional,67.703125
Projetor Led Portátil Espelhamento Wifi 2500 Lúmens T5,"360,99",-5%,5.0,5 vendidos,São Paulo,379.9894736842106
Fogão 5 Bocas Preto com Tripla Chama Dako Diplomata Mesa de Vidro,"2.559,00", , , ,Paraná,2559.0
Aspirador de Pó e Água 12L Compact Eco 1250W Lavor,"559,90", ,5.0,7 vendidos,São Paulo,559.9
Projetor Led - Betec BT960 - 3800 Lumens - Full HD Nativo - Até 250 Polegadas,"1.389,00",-38%,5.0,18 vendidos,São Paulo,2240.322580645161
"𝗙𝗥𝗜𝗧𝗔𝗗𝗘𝗜𝗥𝗔 𝟮 𝗘𝗠 𝟭 𝗔𝗜𝗥𝗙𝗥𝗬𝗘𝗥 𝗗𝗜𝗚 𝗚𝗥𝗜𝗟𝗟 𝟱 𝗟𝗜𝗧𝗥𝗢𝗦 𝗖/ 𝗖𝗘𝗦𝗧𝗢 𝗗𝗘 𝗩𝗜𝗗𝗥𝗢 𝗩𝗜𝗦Ã𝗢 𝟯𝟲𝟬º,𝟭.𝟱𝟬𝟬𝗪, 𝗚𝗜𝗥𝗔𝗧Ó𝗥𝗜𝗔, 𝟭𝟮𝟳𝗩.","1.119,90",-44%, , ,Minas Gerais,1999.821428571428
Aquecedor Britânia AB1500P 2 em 1,"99,90",-17%,4.8,"5,9mil vendidos",Santa Catarina,120.3614457831325
Centrífuga de Roupas Britânia BCR1 Light Cesto Extragrande 15Kg,"449,90",-8%,4.8,"1,3mil vendidos",Santa Catarina,489.0217391304348
Processador Compacto Britânia 300W BMP900P Turbo,"119,90",-8%,4.9,"8,8mil vendidos",Santa Catarina,130.3260869565217
Mini Máquina Costura Portátil Com Pedal Elétrica Costureira Bivolt 110V/220V,"66,87",-44%,5.0,93 vendidos,São Paulo,119.4107142857143
Sanduicheira e Mini Grill Multilaser Gourmet 220V 750W Vermelha - CE149,"117,29",-15%, , ,Espírito Santo,137.9882352941177
Fogão Elétrico Portátil Elgin 2 Bocas - 127v,"149,90", ,4.7,626 vendidos,Espírito Santo,149.9
Suporte Pedestal Rack de Chao Tv 37 á 70 Polegadas Aquário,"528,90",-12%,4.8,61 vendidos,São Paulo,601.0227272727273
Cooktop 5 Bocas Preto com Mesa de Vidro Atlas U Top Bivolt,"639,00", ,5.0,5 vendidos,Paraná,639.0
Forno Elétrico 43L Britânia BFE43 Dupla Resistência,"299,90",-23%,4.8,"2,6mil vendidos",Santa Catarina,389.4805194805194
[Kit3/1] Controle Remoto Código 433MHz Universal para Porta de Garagem/Portão Automático Elétrico para Carros Elétricos,"9,96",-78%,4.8,331 vendidos,Internacional,45.27272727272728
Mini Projetor de Imagens 800ML Bi Volt 12V 20W - PRETO,"245,10",-5%, , ,São Paulo,258.0
Mini máquina de lavar roupa 11L dobrável portátil moderna máquina de lavar automática roupa interior de viagem,"159,99",-59%,4.6,6mil vendidos,São Paulo,390.2195121951219
Projetor HY300 Wi-fi Lançamento Portátil com Android 11 USB HDtv Bluetooth Smart Cinema,"286,25",-43%,4.9,360 vendidos,São Paulo,502.1929824561403
Mini Máquina De Costura Multifuncional Doméstica Com Pedal Portátil Composta de 12 Pontos - Bivolt,"204,99",-29%,4.7,934 vendidos,São Paulo,288.7183098591549
Aspirador De Pó Vertical 2 Em 1 Bas1290v 1250w Britânia,"188,19",-1%,4.9,"1,5mil vendidos",Minas Gerais,190.0909090909091
1Set 4200Pa Aspirador De Pó Portátil Sem Fio Potente Ciclone De Sucção Recarregável 6053 Carga Para Pêlos De Animais Domésticos,"105,85",-40%,4.8,547 vendidos,Internacional,176.4166666666667
Mini Processador E Triturador E Moedor Mallory 130w Premium (220V),"187,68",-5%,4.9,71 vendidos,Ceará,197.5578947368421
Microondas Philco PMO30EP 28 Litros Preto Com Porta Espelhada 1400w,"799,90", ,4.8,239 vendidos,Espírito Santo,799.9
Aspirador de Pó Vertical e Portátil WAP HIGH SPEED BLACK 1300W 2 em 1 Filtro HEPA,"209,90", ,4.9,"1,3mil vendidos",Espírito Santo,209.9
"Liquidificador Britânia BLQ970V Turbo 900W 2,6L","99,90",-23%,4.8,"2,9mil vendidos",Santa Catarina,129.7402597402597
【Promoção】Pé Calcador De Fazer Overlock Em Zig Zag Com Corte,"38,90",-52%,4.8,429 vendidos,Internacional,81.04166666666667
Conversor Digital de TV Intelbras com Gravador CD 700,"123,40",-9%,4.8,66 vendidos,São Paulo,135.6043956043956
Refrigerador Brastemp Side Inverse 3 Portas Frost Free 554 Litros Inox 127V BRO85AK,"7.099,00",-30%, , ,Espírito Santo,10141.42857142857
Aspirador de Pó Britânia 2 em 1 Preto com Laranja BAS1010P Filtro Hepa 1000W,"209,90", ,4.9,"10,5mil vendidos",Espírito Santo,209.9
CFSTORE Home Fogão A Gás Capa À Prova De Vento Do Protetor Suporte De Reflexão De Fogo Tampa Da Cozinha D9E9,"37,99",-40%,4.6,409 vendidos,Internacional,63.31666666666667
Controle Remoto para Ventilador e Luminária de Teto - Capacitivo - Living5040,"129,91",-5%,4.6,24 vendidos,Minas Gerais,136.7473684210526
Aspirador de Pó Vertical 2 em 1 Karcher VCL 1 com Filtro Hepa 1000W,"179,00",-40%,4.9,"1,6mil vendidos",São Paulo,298.3333333333334
Fogão Cooktop de Philco Elétrico Volcano 4 bocas PCT44VC Preto 220v,"1.399,90", ,4.9,164 vendidos,Espírito Santo,1399.9
Forno Elétrico Philco PFE70I 70 Litros Inox,"989,90", ,4.8,191 vendidos,Espírito Santo,989.9
VISWE interruptor inteligente alexa interruptor inteligente com tomada tuya interruptor inteligente，118*72mm painel de vidro,"81,74",-29%,4.9,233 vendidos,Internacional,115.1267605633803
Cozedor Frigideira A Vapor Multiuso Elétrico Cozinha Ovos,"123,50",-5%, ,2 vendidos,São Paulo,130.0
Mini máquina de lavar roupa dobrável portátil moderna máquina de lavar automática roupa interior de viagem bivolt TINNY YOU,"99,99",-75%,4.5,"2,8mil vendidos",São Paulo,399.96
Multiprocessador PMP1600 127v 1700w Philco,"370,00",-60%,4.9,209 vendidos,Santa Catarina,925.0
"Campainha inteligente sem fio, 300m de distância sensível, 5 velocidades de Volume ajustável e 60 toques, Campainha doméstica à prova d'água (Conjunto de campainha clássica: 1 Botão +1 Receptor)","46,07",-37%,4.9,186 vendidos,Internacional,73.12698412698413
Chromecast Google Tv  4k 8gb Snow Com 2gb De Memória Ram,"539,87",-6%, ,1 vendidos,São Paulo,574.3297872340426
"Batedeira Britânia Perola 550 Neve 4,3L 500W","109,90",-15%,4.9,"1,2mil vendidos",Santa Catarina,129.2941176470588
Purificador de Água Natural Consul Branco CPC31ABONA,"279,17",-16%,4.9,399 vendidos,São Paulo,332.3452380952381
Novo H69A73 Substituição Do Controle Remoto Por Voz Para O Amazon Fire TV Stick Lite Com,"35,98",-73%,4.8,625 vendidos,Internacional,133.2592592592592
Aspirador Portátil Automotivo Potente Recarregável,"123,40",-5%,2.0,1 vendidos,São Paulo,129.8947368421053
"Fritadeira Air Fryer Philco Jumbo Inox 7,2L  PFR06PI","449,90",-10%,4.9,1mil vendidos,Santa Catarina,499.8888888888889
Fogão Elétrico Portátil Fogareiro Cooktop 2500w Camping Disco Indução Ou Espiral,"119,99",-52%,4.8,367 vendidos,São Paulo,249.9791666666667
Moedor Multifuncional de Café e Especiarias 110V com Design em Aço Inoxidável 4 Lâminas,"40,99",-44%,4.8,422 vendidos,São Paulo,73.19642857142857
Moving Head Spot Led Osram 60w 8 Cores + 8 Desenhos Dmx Dj,"758,57",-5%, ,1 vendidos,São Paulo,798.4947368421053
Máquina De Algodão Doce Portátil - 110v,"108,99",-45%,4.7,696 vendidos,São Paulo,198.1636363636363
Mini Maquina De Donuts Café Da Manhã Capacidade Para 7 Mini Rosquinha Elétrica 110V Portátil,"119,99",-23%, , ,São Paulo,155.8311688311688
"Visor Digital De Porta Peephole Câmera Sino De 2,8 Polegadas Tela LCD Visão Noturna Tiro Fotográfico Monitoramento Para Segurança Doméstica [19] [Nova Chegada]","169,99",-60%,4.9,352 vendidos,Internacional,424.975
"Ventilador de Mesa 40cm 16"" c/ 5 Hélices, 3 Velocidades Oscilante","140,05",-22%, , ,São Paulo,179.5512820512821
3 em 1 Misturador Elétrico Recarregável Portátil Para Bebidas,"69,99",-55%,4.9,"1,2mil vendidos",Internacional,155.5333333333333
Projetor Datashow Tomate Mpr-2008 5000 Lumens 110v/220v Cor Preto,"2.000,00",-20%, , ,São Paulo,2500.0
Pé Calcador De Fazer Overlock Em Zig Zag Com Corte,"38,90",-55%,4.8,"1,9mil vendidos",Internacional,86.44444444444444
"Câmera De Vídeo Sem Fio Para Campainha Com Intercomunicador Casa Versão Noturna Infravermelha De Dois Caminhos Anel De Porta De 4,3 Polegadas Tela Necessidade De Aplicação","189,00",-55%,4.8,137 vendidos,Internacional,420.0000000000001
Grill Sanduicheira Grelhados Fit Inox Garantia Promoção Hoje,"197,91",-10%, , ,São Paulo,219.9
2023 Alexa Google Controle de Voz Doméstico TUYA Universal Mini Smart Home Infravermelho Wifi IR Controlador Remoto (book.br),"88,71", ,4.2,"1,9mil vendidos",Internacional,88.71
ESPREMEDOR DE FRUTAS EASY BLACK - 220V LENOXX,"108,81",-10%, , ,São Paulo,120.9
Woolley 16A Adaptador De Plugue Inteligente Padrão Brasil Wifi Tomada De Energia Monitor De Vida Útil APP Google Home Alexa,"32,80",-67%,4.8,"1,9mil vendidos",Internacional,99.3939393939394
lampada led com ventilador de teto casa sala quarto branco controle remoto silencioso 85v potente,"118,95",-5%, , ,Rio de Janeiro,125.2105263157895
1080P Vídeo WiFi Porta De Intercomunicador Sem Fio IR Visão Noturna 4.3inch Tela IPS De 2 Vias 2.4G Para Villa Home Office,"224,13",-45%,4.9,145 vendidos,Internacional,407.5090909090908
Kit 3 Sensor Presença Frontal Temporizador APP Smart X Control,"110,45",-5%, , ,São Paulo,116.2631578947368
2022 HOT 4 Em 1 Automático Recarregável Desinfecção UV Aspirador De Pó,"69,99",-47%,4.2,"1,6mil vendidos",Internacional,132.0566037735849
Caneca De Café YL Cup Warmer Isolamento USB 55 ° Termostato C 220V Porta Copos Chá Leite BR1,"29,99",-56%,4.2,451 vendidos,Internacional,68.15909090909092
"Faixa De Alimentação Multifuncional Com Tomada De Extensão USB , Adaptador De Energia Proteção Contra Surtos 6 Portas De 4 (2 C) , 5 Pés , Universal Para Montagem Em Parede Casa , Escritório","68,06",-35%,4.5,146 vendidos,Internacional,104.7076923076923
Global 4K TV Stick e Android 12.1 Smart TV98 Media Dual 2.4G 5G Wifi 8GB 128GB 4K HD,"95,90",-47%,4.4,175 vendidos,Internacional,180.9433962264151
Air Fryer Forno Elétrico Automático Multi-Função Inteligente Doméstico,"204,00",-61%,4.2,19 vendidos,Internacional,523.0769230769231
Painel Solar De 10W 10Watt 12V 166MA Com Mini Sistema Fio Bateria Monocristalina Para Carregador De Celular,"35,99",-50%,4.6,308 vendidos,Internacional,71.98
Kool 4 In 1 Aspirador De Pó Bocal De Escova Home Kit De Ferramentas De Escada Com Fendas 32mm,"30,50",-64%,4.9,219 vendidos,Internacional,84.72222222222223
【Promoção】1pc Flat Car Ferramentas De Zíper Superior Máquina De Costura Industrial Clip Linha De Plataforma Fixa Conjunto Presser Assistente De Pé,"40,80",-32%,4.9,92 vendidos,Internacional,60.0
1pc Máquina De Lavar Roupa Almofadas Universais Anti-Vibração/Pés De Geladeira Ajustáveis/Almofada Antiderrapante/Móveis À Prova De Umidade Que Reduzem O Ruído Base Para Elevação,"32,29",-80%,4.3,438 vendidos,Internacional,161.45
"1pc Flat Car F88 Universal Carro Esquerda E Direita Calcador Unilateral Ajustável , Novo Seis Em Um , Multi-Funções , Máquina De Costura Industrial","37,98",-44%,4.9,187 vendidos,Internacional,67.82142857142856
Capacidade Mini Ferro De Passar Roupa Artesanal Elétrico Portátil Prensa Térmica Diy Pequeno Para Engomar Aparelhos De Lavar EU/US/UK Plug Nice,"41,73",-60%,4.9,180 vendidos,Internacional,104.325
Tampa De Proteção Da Placa Do Forno De Microondas Kool Microwave Limpa,"80,50",-68%,4.8,75 vendidos,Internacional,251.5625
Ce Dedo Oxímetro de Pulso Dedo Clipe Monitor de Saturação de Oxigênio no sangue Pi Taxa Respiratória -ele.br Medidor de Freqüência Cardíaca,"77,69",-59%,4.9,140 vendidos,Internacional,189.4878048780488
Caneta Laser Verde De 532nm De Alcance De 10 Milhas De Alta Potência Visível Lazer,"15,50",-71%,4.3,401 vendidos,Internacional,53.44827586206896
Tuya Wifi Smart Living 4x4 Interruptor de luz Sensor de toque de parede 4/6/8 Gang Jammer Painel de vidro Controle remoto Alexa Google Home fundo do mar,"60,25",-52%,5.0,60 vendidos,Internacional,125.5208333333333
[BRCOLAXI1] Interruptor Adaptador De Recarga Do Conector De Saída Plana De Gás Para Exterior,"45,77",-37%,4.9,339 vendidos,Internacional,72.65079365079366
[Receptor Portátil De Controle Remoto Sem Fio De 3 Pinos XLR Para Máquina De Nevoeiro Novo,"40,12",-75%,4.4,90 vendidos,Internacional,160.48
2222lr/. 1777 Cal/9mm 38SL/223 Colimador Laser Vermelho t Barril Final,"76,98",-48%,4.1,21 vendidos,Internacional,148.0384615384615
Novo Kit Universal De Controle Remoto Da Lâmpada Do Ventilador De Teto AC 110-240V Interruptor De Temporização Transmissor De Velocidade Vento Ajustado Receptor,"41,27",-38%,4.7,61 vendidos,Internacional,66.56451612903227
"SUHU 200Pcs Botão De Pressão Tátil , Mini Interruptor Micro Momentâneo De 4 Pinos , Kit Sortimento De 6x6 mm De Toque Placa De Circuito Eletrônico","32,90",-69%,4.8,90 vendidos,Internacional,106.1290322580645
Tuya WiFi 1 2 Gangue 80A Medidor De Energia Inteligente Com Grampo De Sensor De Corrente Monitor Elétrica De Controle De Vida Estatísticas Equipamento,"88,20",-30%,5.0,25 vendidos,Internacional,126.0
Zemismart Tuya Zigbee Push Wall Light Switches 6 Gangues Com Neutro Controle De Aplicativos Alexa Google Home Smartthings,"173,01",-11%,5.0,28 vendidos,Internacional,194.3932584269663
Novo H69A73 Substituição De Controle Remoto De Voz Para O Amazon Fire TV Stick Lite Com,"34,99",-75%,4.8,72 vendidos,Internacional,139.96
A10 mini Projetor HD Portátil De Qualidade De Imagem Multifuncional Compatível Com Um Estande,"438,00", ,4.6,"2,6mil vendidos",Internacional,438.0
Removedor Papa Bolinhas Pelos Elétrico Para Roupas Recarregável Super Prático,"24,99",-44%,4.8,111 vendidos,São Paulo,44.62499999999999
2.4G Rato Sem Fio MX3 Air Mouse Mini Teclado Controle Remoto De Voz Com Luz De Fundo Aprendizagem IR Para PC Android TV Box,"34,80",-32%,4.6,38 vendidos,Internacional,51.1764705882353
"Peça De Substituição De Lâmina Cruzada Compatível Com Magic-(Série 250W , MB1001) De Aço Inoxidável","37,87",-19%,4.8,67 vendidos,Internacional,46.75308641975308
Projetor Portátil Pocket HD 1080P Led Home Mini YG300 Vídeo Lumens Sistema de Home Theater Para Celular Compatível Com HDMI USB Audio Home Media Player Beamer,"119,80",-35%,4.5,"5,4mil vendidos",Internacional,184.3076923076923
SMATRUL Tuya Smart Wifi Controle Remoto Infravermelho IR Com Tempo Ar Condicionado Tv Dvd Voice Home Alexa E Google Assistant,"44,94",-28%,4.9,45 vendidos,Internacional,62.41666666666666
Aspirador De Pó Usb Portátil Completo Linha Premium Carro E Casa 2000mAh,"33,50",-44%,4.3,54 vendidos,São Paulo,59.82142857142856
Idealistas Xícaras De Café E Pires Suporte Para 6 6 Placas Canecas Modernas Duráveis Bancada Nice,"38,16",-62%,4.1,14 vendidos,Internacional,100.4210526315789
Panela Grill Elétrico Multiuso Easy Red Antiaderente 220v,"159,21",-10%,5.0,3 vendidos,São Paulo,176.9
Fogão 5 Bocas Preto com Frente em Vidro Espelhado e Timer Digital Dako Diplomata Glass Grill Style Bivolt,"3.499,00", ,4.8,121 vendidos,Paraná,3499.0
Mini Projetor LED Pico Ultra Portátil YG300 Pro Para Home HDMI USB lcd projektor,"106,00",-38%,4.6,"2,6mil vendidos", ,170.9677419354839
Mixer E Processador 3 Em 1 Mallory Trikxer 500w Inox,"179,90",-32%,4.9,6mil vendidos,Espírito Santo,264.5588235294118
Fogão 5 bocas Dako Magister Style com Mesa de Vidro e Tripla Chama - Bivolt,"2.369,00", ,4.8,115 vendidos,Paraná,2369.0
Ventilador de Parede Oscilante 50cm 130w Good Ponente Turbão LCG,"177,70",-9%,4.8,985 vendidos,Santa Catarina,195.2747252747253
Sanduicheira Minigrill Gourmet 127V com 750W Chapa Dupla e com Revestimento Antiaderente Preta Multilaser - CE043,"99,90",-26%, , ,Espírito Santo,135.0
Desumidificador de Ar Elétrico Led 127-220v Antimofo 2200ml Tubrax,"719,90", ,4.8,267 vendidos,Santa Catarina,719.9
Ventilador De Teto Com Lâmpada Bulbo Led Integradas Com Controle Remoto 36W Bivolt,"113,03",-5%, ,2 vendidos,São Paulo,118.9789473684211
PANELA ELETRICA AGRATTO MANGIARE APEQ01I-01 PRETA QUADRADA 30CM 1500W 127V,"159,99",-6%,4.8,424 vendidos,Espírito Santo,170.2021276595745
Panela Eletrica Pressao Itatiaia Midi 5 Lts Ppmid1 127v,"450,00", ,4.8,332 vendidos,Espírito Santo,450.0
Ventilador ESGOTADO,"149,54",-21%,5.0,3 vendidos,São Paulo,189.2911392405063
Fogão 5 bocas Dako Supreme Glass Branco com mesa de vidro - Bivolt,"2.149,00", ,5.0,1 vendidos,Paraná,2149.0
Ventilador de Parede Ventisol 50cm Steel 6 Pás - Bivolt*,"206,90",-28%,4.8,"2,8mil vendidos",Espírito Santo,287.3611111111111
CHALEIRA ELETRICA THERMO ON CEL388 PRETO 1.7L 127V CADENCE,"119,00",-21%,4.9,"1,2mil vendidos",Espírito Santo,150.632911392405
